{
  "$schema": "https://json-schema.org/draft/2020-12/schema",
  "type": "object",
  "required": ["schema_version", "id", "version", "title", "source_id", "statement", "public_materials"],
  "properties": {
    "schema_version": {"const": 1},
    "id": {"type": "string", "minLength": 1},
    "version": {"type": "string", "minLength": 1},
    "title": {"type": "string", "minLength": 1},
    "source_id": {"type": "string", "minLength": 1},
    "statement": {"type": "string", "minLength": 1},
    "public_materials": {"type": "array", "items": {"type": "string"}, "minItems": 1}
  },
  "additionalProperties": false
}
