{
  "id": "occt-31835",
  "public_materials": [
    "public/bug31835_1.tcl",
    "public/harness_bug31835_1.tcl",
    "public/bug31835_2.tcl",
    "public/harness_bug31835_2.tcl",
    "public/draw_pure_display_noop.tcl"
  ],
  "schema_version": 1,
  "source_id": "occt-d9d3107d8df1",
  "statement": "statement.md",
  "title": "Mantis #31835 — three-cylinder common",
  "version": "1"
}
