{
  "id": "occt-27252",
  "public_materials": [
    "public/bug27252_1.tcl",
    "public/draw_pure_display_noop.tcl",
    "public/harness_bug27252_1.tcl",
    "public/inputs/bug27221.brep"
  ],
  "schema_version": 1,
  "source_id": "occt-b55bd0235351",
  "statement": "statement.md",
  "title": "Mantis #27252 — cylinder and plane intersection",
  "version": "1"
}
