{
  "id": "occt-27773",
  "public_materials": [
    "public/bug27773.tcl",
    "public/draw_pure_display_noop.tcl",
    "public/harness_bug27773.tcl"
  ],
  "schema_version": 1,
  "source_id": "occt-b55bd0235351",
  "statement": "statement.md",
  "title": "Mantis #27773 — offset circle and line section",
  "version": "1"
}
