{
  "id": "occt-29807",
  "public_materials": [
    "public/bug29807_i5002.tcl",
    "public/harness_bug29807_i5002.tcl",
    "public/bug29807_svm01.tcl",
    "public/harness_bug29807_svm01.tcl",
    "public/bug29807_svm02.tcl",
    "public/harness_bug29807_svm02.tcl",
    "public/draw_pure_display_noop.tcl",
    "public/inputs/bug29807-obj.brep",
    "public/inputs/bug29807-tool.brep"
  ],
  "schema_version": 1,
  "source_id": "occt-d9d3107d8df1",
  "statement": "statement.md",
  "title": "Mantis #29807 — conic intersection curves",
  "version": "1"
}
