{
  "id": "occt-21494",
  "public_materials": [
    "public/bug21494_2.tcl",
    "public/draw_pure_display_noop.tcl",
    "public/harness_bug21494_2.tcl",
    "public/official_9bc5f585_intss_begin.tcl"
  ],
  "schema_version": 1,
  "source_id": "occt-2613378e60ff",
  "statement": "statement.md",
  "title": "Mantis #21494 — cone/sphere surface intersection",
  "version": "2"
}
